{
  "spec_version": "0.1.0",
  "event_id": "evt-cpa-valid",
  "auction_id": "auc-valid",
  "bid_id": "bid-valid",
  "timestamp": "2024-03-02T12:00:00Z",
  "event_type": "cpa.conversion",
  "conversion_value": 99.0,
  "conversion_currency": "USD",
  "conversion_window_hours": 24,
  "signature": "sig-cpa"
}
